{
  "global_errors": [],
  "provider": {
    "id": "vitest",
    "version": "4.1.10"
  },
  "run_id": "a3cf08feaabe4d89a62ffebb14bcd482",
  "schema_version": 1,
  "tests": [
    {
      "attempts": 1,
      "container": "tests/team-filter-count-controller.test.js",
      "duration_ms": 55.6213,
      "evidence": "runs/a3cf08feaabe4d89a62ffebb14bcd482/results.json",
      "failure": "expected '显示所选小组' to be '当前显示 2 / 6 支球队' // Object.is equality \nAssertionError: expected '显示所选小组' to be '当前显示 2 / 6 支球队' // Object.is equality\n\nExpected: \"当前显示 2 / 6 支球队\"\nReceived: \"显示所选小组\"\n\n ❯ tests/team-filter-count-controller.test.js:22:38",
      "failure_kind": "assertion",
      "file": null,
      "level": "unit",
      "locator": "tests/team-filter-count-controller.test.js::count-change",
      "original_status": "failed",
      "parameters": "",
      "provider": "vitest",
      "run_id": "a3cf08feaabe4d89a62ffebb14bcd482",
      "status": "failed",
      "test_id": "23dd2606aebf432b275c8cd098ad419c8eca4f54558b7ee5c4370375467c5954"
    },
    {
      "attempts": 1,
      "container": "tests/team-filter-count-controller.test.js",
      "duration_ms": 12.0234,
      "evidence": "runs/a3cf08feaabe4d89a62ffebb14bcd482/results.json",
      "failure": "expected '显示全部球队' to be '当前显示 6 / 6 支球队' // Object.is equality \nAssertionError: expected '显示全部球队' to be '当前显示 6 / 6 支球队' // Object.is equality\n\nExpected: \"当前显示 6 / 6 支球队\"\nReceived: \"显示全部球队\"\n\n ❯ tests/team-filter-count-controller.test.js:27:65",
      "failure_kind": "assertion",
      "file": null,
      "level": "unit",
      "locator": "tests/team-filter-count-controller.test.js::count-clear-rapid-focus",
      "original_status": "failed",
      "parameters": "",
      "provider": "vitest",
      "run_id": "a3cf08feaabe4d89a62ffebb14bcd482",
      "status": "failed",
      "test_id": "f6f70edf5aa1ee6edec14ae579da6ffed99c865bc53aba297efc3c88cf25cce8"
    },
    {
      "attempts": 1,
      "container": "tests/team-filter-count-render.test.js",
      "duration_ms": 60.9731,
      "evidence": "runs/a3cf08feaabe4d89a62ffebb14bcd482/results.json",
      "failure": "expected '显示全部球队' to be '当前显示 2 / 2 支球队' // Object.is equality \nAssertionError: expected '显示全部球队' to be '当前显示 2 / 2 支球队' // Object.is equality\n\nExpected: \"当前显示 2 / 2 支球队\"\nReceived: \"显示全部球队\"\n\n ❯ tests/team-filter-count-render.test.js:14:112",
      "failure_kind": "assertion",
      "file": null,
      "level": "unit",
      "locator": "tests/team-filter-count-render.test.js::count-render",
      "original_status": "failed",
      "parameters": "",
      "provider": "vitest",
      "run_id": "a3cf08feaabe4d89a62ffebb14bcd482",
      "status": "failed",
      "test_id": "57272dd987e49cb81e5242e00e1f9b5833917d5b28a8e5dad1f9c5d5cc8fb2f0"
    },
    {
      "attempts": 1,
      "container": "tests/team-filter-count.test.js",
      "duration_ms": 5.1243,
      "evidence": "runs/a3cf08feaabe4d89a62ffebb14bcd482/results.json",
      "failure": "",
      "failure_kind": "none",
      "file": null,
      "level": "unit",
      "locator": "tests/team-filter-count.test.js::count-all",
      "original_status": "passed",
      "parameters": "",
      "provider": "vitest",
      "run_id": "a3cf08feaabe4d89a62ffebb14bcd482",
      "status": "passed",
      "test_id": "27284dd310e498aa42e83b2702349d28b3819bf501fa33ef2c03cbe11258abaf"
    },
    {
      "attempts": 1,
      "container": "tests/team-filter-count.test.js",
      "duration_ms": 1.1641,
      "evidence": "runs/a3cf08feaabe4d89a62ffebb14bcd482/results.json",
      "failure": "",
      "failure_kind": "none",
      "file": null,
      "level": "unit",
      "locator": "tests/team-filter-count.test.js::count-unequal-union",
      "original_status": "passed",
      "parameters": "",
      "provider": "vitest",
      "run_id": "a3cf08feaabe4d89a62ffebb14bcd482",
      "status": "passed",
      "test_id": "1af43d50d0875fb4acc9d20f2a76a49f9f05cb34bbcb6acb529e3e7cfda09922"
    },
    {
      "attempts": 1,
      "container": "tests/team-filter-count.test.js",
      "duration_ms": 0.3649,
      "evidence": "runs/a3cf08feaabe4d89a62ffebb14bcd482/results.json",
      "failure": "",
      "failure_kind": "none",
      "file": null,
      "level": "unit",
      "locator": "tests/team-filter-count.test.js::count-unknown",
      "original_status": "passed",
      "parameters": "",
      "provider": "vitest",
      "run_id": "a3cf08feaabe4d89a62ffebb14bcd482",
      "status": "passed",
      "test_id": "cc11db223b7368a35cf73c6a5afd0e5402b97f3e9a6e97579fc7df7307302d07"
    },
    {
      "attempts": 1,
      "container": "tests/team-filter-count.test.js",
      "duration_ms": 0.48260000000000003,
      "evidence": "runs/a3cf08feaabe4d89a62ffebb14bcd482/results.json",
      "failure": "",
      "failure_kind": "none",
      "file": null,
      "level": "unit",
      "locator": "tests/team-filter-count.test.js::count-data-replacement",
      "original_status": "passed",
      "parameters": "",
      "provider": "vitest",
      "run_id": "a3cf08feaabe4d89a62ffebb14bcd482",
      "status": "passed",
      "test_id": "8b4dc2669b9e0a77e721e88334569f431160a3801cadf489f455f11828724e3b"
    }
  ]
}
